{
  "$schema": "https://json-schema.org/draft/2020-12/schema",
  "$id": "https://heros.foreal/schemas/assessment.schema.json",
  "title": "Surface Assessment (P33)",
  "description": "An assessment reports, for each of the nine axes, what the repository does and what evidence supports the claim. It carries NO composite score, grade, level or ranking (program ruling R4). The four conditional requirements below are the schema half of P33 task 1.2 \u2014 the Go half is internal/assessment, where every field is unexported and the only way in is a constructor. Both halves exist because they guard different entrances: the type guards Go callers, the schema guards a stored row and a posted payload. internal/assessment/schema_test.go asserts every `enum` here equals its Go closed set exactly — in BOTH directions — so this file cannot become a second, drifting copy of a vocabulary.",
  "type": "object",
  "additionalProperties": false,
  "required": [
    "assessment_id",
    "tenant_id",
    "workflow_id",
    "source_revision",
    "agent_config_hash",
    "started_at_ms",
    "completed_at_ms",
    "spend_usd",
    "spend_cap_usd",
    "findings"
  ],
  "properties": {
    "assessment_id": {
      "type": "string",
      "minLength": 1
    },
    "tenant_id": {
      "type": "string",
      "minLength": 1
    },
    "workflow_id": {
      "type": "string",
      "minLength": 1
    },
    "source_revision": {
      "type": "string",
      "minLength": 1,
      "description": "Half of the pin key. An assessment is OF a revision, which is why no finding here can be `stale` with respect to it."
    },
    "agent_config_hash": {
      "type": "string",
      "minLength": 1,
      "description": "The other half (FR16). Without it a finding cannot be attributed to the configuration that produced it."
    },
    "started_at_ms": {
      "type": "integer"
    },
    "completed_at_ms": {
      "type": "integer"
    },
    "spend_usd": {
      "type": "number",
      "minimum": 0
    },
    "spend_cap_usd": {
      "type": "number",
      "minimum": 0
    },
    "findings": {
      "type": "array",
      "description": "Exactly nine \u2014 one per axis, never fewer. An axis with nothing to say reports `not_measured` with its missing input; it is never dropped (FR1). `minItems`/`maxItems` bound the count; the set equality against the nine axes is checked in Go, where a duplicate can be named.",
      "minItems": 9,
      "maxItems": 9,
      "items": {
        "$ref": "#/$defs/Finding"
      }
    }
  },
  "$defs": {
    "Finding": {
      "type": "object",
      "additionalProperties": false,
      "description": "One axis's result. The nine keys three consumers switch on, plus the payload of exactly one state.",
      "required": [
        "axis",
        "state",
        "origin",
        "claim",
        "evidence_ref"
      ],
      "properties": {
        "axis": {
          "type": "string",
          "enum": [
            "context",
            "graph",
            "harness",
            "loop",
            "memory",
            "model",
            "prompt",
            "skills",
            "tools"
          ]
        },
        "state": {
          "type": "string",
          "enum": [
            "measured",
            "not_measured",
            "observed",
            "refused"
          ]
        },
        "origin": {
          "type": "string",
          "enum": [
            "inferred",
            "structural"
          ]
        },
        "claim": {
          "type": "string",
          "minLength": 1,
          "description": "The sentence a reader reads. Required in every state \u2014 a `not_measured` finding's claim IS \"here is what is missing and what you could do\", which is the difference between a report someone acts on and one they discount."
        },
        "evidence_ref": {
          "$ref": "#/$defs/EvidenceRef"
        },
        "missing_input": {
          "type": "string",
          "enum": [
            "budget_exhausted",
            "frontend_emits_no_edges",
            "inference_abstained",
            "missing_credential",
            "no_call_sites_discovered",
            "no_runnable_entry_point",
            "no_source_snapshot",
            "not_visible_in_static_ir",
            "sandbox_refusal",
            "unresolved_in_ir",
            "unsupported_language"
          ]
        },
        "refusal_cause": {
          "type": "string",
          "enum": [
            "analysis",
            "frontend",
            "language"
          ],
          "description": "Which of exactly three things this build lacks. Never a generic \"unsupported\": the three send a reader to three different places, and only one of them is the customer's problem."
        },
        "provider_model_version": {
          "type": "string",
          "minLength": 1
        },
        "inference_address": {
          "type": "string",
          "minLength": 1
        },
        "eval_set": {
          "$ref": "#/$defs/EvalSetReport"
        }
      },
      "allOf": [
        {
          "$comment": "state = not_measured \u21d2 missing_input, and no other state may carry one. The negative half is as load-bearing as the positive one: a `refused` finding carrying a missing input renders in two different message shapes depending on which field a console checks first.",
          "if": {
            "properties": {
              "state": {
                "const": "not_measured"
              }
            },
            "required": [
              "state"
            ]
          },
          "then": {
            "required": [
              "missing_input"
            ]
          },
          "else": {
            "not": {
              "required": [
                "missing_input"
              ]
            }
          }
        },
        {
          "$comment": "state = refused \u21d2 refusal_cause, and no other state may carry one.",
          "if": {
            "properties": {
              "state": {
                "const": "refused"
              }
            },
            "required": [
              "state"
            ]
          },
          "then": {
            "required": [
              "refusal_cause"
            ]
          },
          "else": {
            "not": {
              "required": [
                "refusal_cause"
              ]
            }
          }
        },
        {
          "$comment": "origin = inferred \u21d2 BOTH attribution fields. Checked as a pair: a pin address with no model version records where an answer came from but not what produced it, so a provider's upgrade would still be invisible (design D7).",
          "if": {
            "properties": {
              "origin": {
                "const": "inferred"
              }
            },
            "required": [
              "origin"
            ]
          },
          "then": {
            "required": [
              "provider_model_version",
              "inference_address"
            ]
          },
          "else": {
            "allOf": [
              {
                "not": {
                  "required": [
                    "provider_model_version"
                  ]
                }
              },
              {
                "not": {
                  "required": [
                    "inference_address"
                  ]
                }
              }
            ]
          }
        },
        {
          "$comment": "state = measured \u21d2 an eval-set report, and no other state may carry one. Decisiveness travels with the score wherever the score is reported; a score that COULD arrive without it would eventually arrive without it.",
          "if": {
            "properties": {
              "state": {
                "const": "measured"
              }
            },
            "required": [
              "state"
            ]
          },
          "then": {
            "required": [
              "eval_set"
            ]
          },
          "else": {
            "not": {
              "required": [
                "eval_set"
              ]
            }
          }
        },
        {
          "$comment": "The two illegal cells of the four-states \u00d7 two-origins matrix. A measurement comes from an eval run, never from a model reading code; a refusal is a fact about THIS BUILD's capability, not a conclusion a model can reach.",
          "if": {
            "properties": {
              "state": {
                "const": "measured"
              }
            },
            "required": [
              "state"
            ]
          },
          "then": {
            "properties": {
              "origin": {
                "const": "structural"
              }
            }
          }
        },
        {
          "if": {
            "properties": {
              "state": {
                "const": "refused"
              }
            },
            "required": [
              "state"
            ]
          },
          "then": {
            "properties": {
              "origin": {
                "const": "structural"
              }
            }
          }
        }
      ]
    },
    "EvidenceRef": {
      "type": "object",
      "additionalProperties": false,
      "description": "A reference INTO an existing surface (design D5). The assessment is an index over evidence the platform already holds, never a second place a number is computed. No URL is stored: the surface owns its own route shape, and a stored URL is a copy of the router that eventually serves a 404.",
      "required": [
        "surface",
        "locator"
      ],
      "properties": {
        "surface": {
          "type": "string",
          "enum": [
            "board",
            "graph",
            "scorecard"
          ]
        },
        "locator": {
          "type": "string",
          "minLength": 1
        },
        "fragment": {
          "type": "string",
          "minLength": 1,
          "description": "Narrows to one part of the surface. Its ABSENCE means \"the whole surface\", never \"unknown\"."
        }
      }
    },
    "EvalSetReport": {
      "type": "object",
      "additionalProperties": false,
      "description": "The properties that say HOW TO READ a score, on the same object as the score so they cannot be separated from it.",
      "required": [
        "eval_set_hash",
        "score",
        "n_cases",
        "coverage_measured",
        "cases"
      ],
      "properties": {
        "eval_set_hash": {
          "type": "string",
          "minLength": 1
        },
        "score": {
          "$ref": "#/$defs/Interval"
        },
        "n_cases": {
          "type": "integer",
          "minimum": 0
        },
        "oracle_coverage": {
          "type": "number",
          "minimum": 0,
          "maximum": 1
        },
        "n_indecisive": {
          "type": "integer",
          "minimum": 0,
          "description": "Cases carrying an oracle that can never fail \u2014 the most misleading cases in a set, because they look measured and decide nothing."
        },
        "coverage_measured": {
          "type": "boolean",
          "description": "Whether oracle coverage was measured AT ALL. A separate boolean rather than a sentinel in `oracle_coverage`, because 0.0 is a number somebody measured and \"we do not have this\" is a different fact."
        },
        "vacuous_dimensions": {
          "type": "array",
          "items": {
            "type": "string",
            "minLength": 1
          },
          "description": "Coverage axes no case exercises. Named, not counted: \"nothing to measure\" is not \"everything covered\"."
        },
        "cases": {
          "type": "array",
          "description": "The enumeration (FR13). A count is not a case list.",
          "items": {
            "$ref": "#/$defs/CaseView"
          }
        }
      }
    },
    "Interval": {
      "type": "object",
      "additionalProperties": false,
      "description": "A measured value with its confidence interval and the number of seeds behind it. `n_seeds` is required and at least 1: no number is reported without the size of the set behind it (\u00a77.1).",
      "required": [
        "mean",
        "ci_low",
        "ci_high",
        "n_seeds"
      ],
      "properties": {
        "mean": {
          "type": "number"
        },
        "ci_low": {
          "type": "number"
        },
        "ci_high": {
          "type": "number"
        },
        "n_seeds": {
          "type": "integer",
          "minimum": 1
        }
      }
    },
    "CaseView": {
      "type": "object",
      "additionalProperties": false,
      "required": [
        "case_id",
        "oracle"
      ],
      "properties": {
        "case_id": {
          "type": "string",
          "minLength": 1
        },
        "suite": {
          "type": "string"
        },
        "oracle": {
          "$ref": "#/$defs/OracleVerdict"
        }
      }
    },
    "OracleVerdict": {
      "type": "object",
      "additionalProperties": false,
      "description": "Whether this case's oracle can ever return \"no\", and when it cannot, why. Read from evalharness.Case.DecisiveOracle rather than recomputed \u2014 a second implementation of that probe would be a second answer to a question with one correct one.",
      "required": [
        "decisive",
        "kind"
      ],
      "properties": {
        "decisive": {
          "type": "boolean"
        },
        "kind": {
          "type": "string",
          "minLength": 1
        },
        "reason": {
          "type": "string"
        }
      },
      "allOf": [
        {
          "$comment": "An oracle that cannot fail must say why. \"3 cases cannot fail\" is a number; the reason is what turns it into a task.",
          "if": {
            "properties": {
              "decisive": {
                "const": false
              }
            },
            "required": [
              "decisive"
            ]
          },
          "then": {
            "required": [
              "reason"
            ],
            "properties": {
              "reason": {
                "minLength": 1
              }
            }
          }
        }
      ]
    }
  }
}
